id,title,artist,year,period,description,image_url,full_details,room_name
Bali-Life,Bali Life,Hendra Gunawan,1960 an,,"Lukisan ini memvisualisasikan keceriaan, warna, dan kehidupan sehari-hari masyarakat Bali melalui gaya figur elongasi khas Hendra Gunawan. Warna-warna cerah dan komposisi berlapis mencerminkan dinamika sosial, ritual budaya, serta karakter masyarakat pesisir. Karya ini sangat dikenal publik karena menggambarkan Bali sebagai ruang hidup yang hangat dan penuh harmonisasi antara manusia, alam, dan budaya lokal.",https://www.sarasvati.co.id/wp-content/uploads/2017/12/Lee-Man-Fong-Bali-Life-1962-1964.-Foto-Christies-1.jpg,"Bali Life adalah judul lukisan terkenal karya pelukis Lee Man Fong, yang menggambarkan kehidupan masyarakat Bali. Lukisan ini terkenal karena nilainya yang fantastis, dengan salah satu versi yang terjual seharga Rp54,30 miliar di balai lelang Christie's Hong Kong pada tahun 2013. Selain lukisan karya Lee Man Fong yang bernilai tinggi, Bali Life juga bisa merujuk pada lukisan-lukisan bergaya klasik Bali lainnya yang menampilkan tema kehidupan sehari-hari di pulau tersebut",Galeri Nasional
starry-night,Malam Berbintang (The Starry Night),Vincent van Gogh,1889,Pasca-Impresionis,"Malam Berbintang adalah lukisan cat minyak di atas kanvas karya pelukis Pasca-Impresionis Belanda Vincent van Gogh. Dilukis pada Juni 1889, lukisan ini menggambarkan pemandangan dari jendela kamar rumah sakit jiwanya di Saint-Rémy-de-Provence yang menghadap ke timur, tepat sebelum matahari terbit, dengan tambahan sebuah desa imajiner.",https://upload.wikimedia.org/wikipedia/commons/thumb/e/ea/Van_Gogh_-_Starry_Night_-_Google_Art_Project.jpg/1024px-Van_Gogh_-_Starry_Night_-_Google_Art_Project.jpg,"Lokasi: MoMA...
Gaya: Sapuan kuas ekspresif...",Aula Impresionis
mona-lisa,Mona Lisa,Leonardo da Vinci,c. 1503–1506,High Renaissance,"Mona Lisa adalah lukisan potret setengah badan karya seniman Italia Leonardo da Vinci. Dianggap sebagai mahakarya arketipal dari Renaisans Italia, lukisan ini telah digambarkan sebagai ""karya seni yang paling dikenal, paling banyak dikunjungi, paling banyak ditulis, paling banyak dinyanyikan, dan paling banyak diparodikan di dunia....",https://upload.wikimedia.org/wikipedia/commons/thumb/e/ec/Mona_Lisa%2C_by_Leonardo_da_Vinci%2C_from_C2RMF_retouched.jpg/800px-Mona_Lisa%2C_by_Leonardo_da_Vinci%2C_from_C2RMF_retouched.jpg,"Subjek: Lisa Gherardini...
Teknik: Sfumato...",Galeri Renaisans
Keris-Mpu-Gandring,Keris Mpu Gandring,Mpu Gandring,Abad ke-12,,"Keris ini sangat terkenal berkat legenda Ken Arok, yang menceritakan kutukan akibat pembuatan keris yang belum selesai. Cerita ini menjadikannya salah satu artefak paling dikenal dalam sejarah Jawa. Motif pamor dan bentuk bilahnya juga sering direkonstruksi dalam seni dan budaya populer.",https://www.sarasvati.co.id/wp-content/uploads/2017/12/Lee-Man-Fong-Bali-Life-1962-1964.-Foto-Christies-1.jpg,"Keris Mpu Gandring adalah keris legendaris yang terkenal dalam sejarah Kerajaan Singasari, dibuat oleh empu bernama Mpu Gandring atas pesanan Ken Arok untuk membunuh Tunggul Ametung. Legenda keris ini sangat kental dengan kutukannya yang konon akan memakan tujuh keturunan Ken Arok, yang diawali dengan kematian Mpu Gandring itu sendiri karena ditusuk oleh Ken Arok saat kerisnya belum selesai dibuat.",History